{"diagnosticCodes":[],"expectedCatalogRefs":["catalog://p2/components/Button"],"expectedExtraction":{"accessibility":[{"catalogRef":"catalog://p2/components/Button/accessibility","sourceRef":"spectrum-design-data://npm/@adobe/spectrum-design-data@0.7.0/package/components/button.json#/accessibility"}],"component":{"catalogRef":"catalog://p2/components/Button","sourceRef":"spectrum-design-data://npm/@adobe/spectrum-design-data@0.7.0/package/components/button.json#/"},"examples":[{"catalogRef":"catalog://p2/components/Button/examples/purpose","sourceRef":"spectrum-design-data://npm/@adobe/spectrum-design-data@0.7.0/package/components/button.json#/documentBlocks/0"}],"propsOptions":[{"catalogRef":"catalog://p2/components/Button/props/variant","sourceRef":"spectrum-design-data://npm/@adobe/spectrum-design-data@0.7.0/package/components/button.json#/options/variant"},{"catalogRef":"catalog://p2/components/Button/props/style","sourceRef":"spectrum-design-data://npm/@adobe/spectrum-design-data@0.7.0/package/components/button.json#/options/style"},{"catalogRef":"catalog://p2/components/Button/props/size","sourceRef":"spectrum-design-data://npm/@adobe/spectrum-design-data@0.7.0/package/components/button.json#/options/size"}],"slots":[{"catalogRef":"catalog://p2/components/Button/slots/icon","sourceRef":"spectrum-design-data://npm/@adobe/spectrum-design-data@0.7.0/package/components/button.json#/slots/1"}],"states":[{"catalogRef":"catalog://p2/components/Button/states/hover","sourceRef":"spectrum-design-data://npm/@adobe/spectrum-design-data@0.7.0/package/components/button.json#/states/0"},{"catalogRef":"catalog://p2/components/Button/states/focus","sourceRef":"spectrum-design-data://npm/@adobe/spectrum-design-data@0.7.0/package/components/button.json#/states/1"},{"catalogRef":"catalog://p2/components/Button/states/disabled","sourceRef":"spectrum-design-data://npm/@adobe/spectrum-design-data@0.7.0/package/components/button.json#/states/2"}],"tokenRefs":[{"catalogRef":"catalog://p2/components/Button/tokenRefs/component-height-75","sourceRef":"spectrum-design-data://npm/@adobe/spectrum-design-data@0.7.0/package/components/button.json#/tokenBindings/0"}],"variants":[{"catalogRef":"catalog://p2/components/Button/variants/accent","sourceRef":"spectrum-design-data://npm/@adobe/spectrum-design-data@0.7.0/package/components/button.json#/options/variant/values/0"}]},"expectedNormalizedIds":["Button"],"expectedResult":"valid","fixtureId":"spectrum-button-valid","fixtureKind":"valid","mappingRefs":["mapping://p2/spectrum/component-map.json#/mappingRows/button-component"],"promotionStatus":"allowed","schemaId":"design-system-ingestion-valid-fixture.v0","sourceRefs":["spectrum-design-data://npm/@adobe/spectrum-design-data@0.7.0/package/components/button.json#/","spectrum-design-data://npm/@adobe/spectrum-design-data@0.7.0/package/components/button.json#/options/variant","spectrum-design-data://npm/@adobe/spectrum-design-data@0.7.0/package/components/button.json#/options/style","spectrum-design-data://npm/@adobe/spectrum-design-data@0.7.0/package/components/button.json#/options/size","spectrum-design-data://npm/@adobe/spectrum-design-data@0.7.0/package/components/button.json#/states/0","spectrum-design-data://npm/@adobe/spectrum-design-data@0.7.0/package/components/button.json#/states/1","spectrum-design-data://npm/@adobe/spectrum-design-data@0.7.0/package/components/button.json#/states/2","spectrum-design-data://npm/@adobe/spectrum-design-data@0.7.0/package/components/button.json#/slots/1","spectrum-design-data://npm/@adobe/spectrum-design-data@0.7.0/package/components/button.json#/anatomy/0","spectrum-design-data://npm/@adobe/spectrum-design-data@0.7.0/package/components/button.json#/accessibility","spectrum-design-data://npm/@adobe/spectrum-design-data@0.7.0/package/components/button.json#/documentBlocks/0","spectrum-design-data://npm/@adobe/spectrum-design-data@0.7.0/package/components/button.json#/tokenBindings/0","spectrum-design-data://npm/@adobe/spectrum-design-data@0.7.0/package/registry/components.json#/","spectrum-design-data://npm/@adobe/spectrum-design-data@0.7.0/package/registry/property-terms.json#/","spectrum-design-data://npm/@adobe/spectrum-design-data@0.7.0/package/fields/property.json#/","spectrum-design-data://npm/@adobe/spectrum-design-data@0.7.0/package/registry/variants.json#/","spectrum-design-data://npm/@adobe/spectrum-design-data@0.7.0/package/registry/states.json#/"],"target":{"component":"button","designSystemId":"adobe-spectrum","packageName":"@adobe/spectrum-design-data","packageVersion":"0.7.0"}}